2026-02-09T11:42:08.2899413Z Current runner version: '2.331.0'
2026-02-09T11:42:08.2923346Z ##[group]Runner Image Provisioner
2026-02-09T11:42:08.2924435Z Hosted Compute Agent
2026-02-09T11:42:08.2924958Z Version: 20260115.477
2026-02-09T11:42:08.2925597Z Commit: 4b342d620503cbe250a3154040964899ea7c9b00
2026-02-09T11:42:08.2926231Z Build Date: 2026-01-15T22:32:41Z
2026-02-09T11:42:08.2926831Z Worker ID: {0e9adb77-3c0d-48a5-a874-83e0c1764847}
2026-02-09T11:42:08.2927518Z Azure Region: northcentralus
2026-02-09T11:42:08.2928065Z ##[endgroup]
2026-02-09T11:42:08.2929457Z ##[group]VM Image
2026-02-09T11:42:08.2930044Z - OS: Linux (x64)
2026-02-09T11:42:08.2930510Z - Source: Docker
2026-02-09T11:42:08.2930983Z - Name: ubuntu:24.04
2026-02-09T11:42:08.2931481Z - Version: 20260120.46.1
2026-02-09T11:42:08.2931992Z ##[endgroup]
2026-02-09T11:42:08.2933219Z ##[group]GITHUB_TOKEN Permissions
2026-02-09T11:42:08.2935530Z Contents: read
2026-02-09T11:42:08.2936024Z Discussions: write
2026-02-09T11:42:08.2937012Z Issues: write
2026-02-09T11:42:08.2937553Z Metadata: read
2026-02-09T11:42:08.2938047Z PullRequests: write
2026-02-09T11:42:08.2938507Z ##[endgroup]
2026-02-09T11:42:08.2940585Z Secret source: Actions
2026-02-09T11:42:08.2945103Z Prepare workflow directory
2026-02-09T11:42:08.3719000Z Prepare all required actions
2026-02-09T11:42:08.3789903Z Getting action download info
2026-02-09T11:42:08.8637497Z Download action repository 'github/gh-aw@15d0e133ebb103ed42485353efea00d7c8c07304' (SHA:15d0e133ebb103ed42485353efea00d7c8c07304)
2026-02-09T11:42:13.9750555Z Download action repository 'actions/download-artifact@018cc2cf5baa6db3ef3c5f8a56943fffe632ef53' (SHA:018cc2cf5baa6db3ef3c5f8a56943fffe632ef53)
2026-02-09T11:42:14.4174842Z Download action repository 'actions/github-script@ed597411d8f924073f98dfc5c65a23a2325f34cd' (SHA:ed597411d8f924073f98dfc5c65a23a2325f34cd)
2026-02-09T11:42:15.0944430Z Complete job name: conclusion
2026-02-09T11:42:15.1644626Z ##[group]Run github/gh-aw/actions/setup@15d0e133ebb103ed42485353efea00d7c8c07304
2026-02-09T11:42:15.1646024Z with:
2026-02-09T11:42:15.1646623Z   destination: /opt/gh-aw/actions
2026-02-09T11:42:15.1647234Z   safe-output-projects: false
2026-02-09T11:42:15.1648058Z ##[endgroup]
2026-02-09T11:42:15.1848210Z ##[group]Run /home/runner/work/_actions/github/gh-aw/15d0e133ebb103ed42485353efea00d7c8c07304/actions/setup/setup.sh
2026-02-09T11:42:15.1849875Z [36;1m/home/runner/work/_actions/github/gh-aw/15d0e133ebb103ed42485353efea00d7c8c07304/actions/setup/setup.sh[0m
2026-02-09T11:42:15.1860622Z shell: /usr/bin/bash --noprofile --norc -e -o pipefail {0}
2026-02-09T11:42:15.1861351Z env:
2026-02-09T11:42:15.1861844Z   INPUT_DESTINATION: /opt/gh-aw/actions
2026-02-09T11:42:15.1862501Z   INPUT_SAFE_OUTPUT_PROJECTS: false
2026-02-09T11:42:15.1863129Z ##[endgroup]
2026-02-09T11:42:15.7248619Z Copying activation files to /opt/gh-aw/actions
2026-02-09T11:42:15.7249628Z Safe-output-projects support: false
2026-02-09T11:42:15.7250282Z Created directory: /opt/gh-aw/actions
2026-02-09T11:42:15.7251325Z Script directory: /home/runner/work/_actions/github/gh-aw/15d0e133ebb103ed42485353efea00d7c8c07304/actions/setup
2026-02-09T11:42:15.7252925Z Looking for JavaScript sources in: /home/runner/work/_actions/github/gh-aw/15d0e133ebb103ed42485353efea00d7c8c07304/actions/setup/js
2026-02-09T11:42:15.7263060Z Contents of /home/runner/work/_actions/github/gh-aw/15d0e133ebb103ed42485353efea00d7c8c07304/actions/setup:
2026-02-09T11:42:15.7264487Z total 68
2026-02-09T11:42:15.7265002Z drwxr-xr-x 6 runner runner  4096 Feb  9 11:42 .
2026-02-09T11:42:15.7265805Z drwxr-xr-x 4 runner runner  4096 Feb  9 11:42 ..
2026-02-09T11:42:15.7266529Z -rw-r--r-- 1 runner runner  3435 Feb  8 20:56 README.md
2026-02-09T11:42:15.7267402Z -rw-r--r-- 1 runner runner   844 Feb  8 20:56 action.yml
2026-02-09T11:42:15.7268180Z drwxr-xr-x 3 runner runner 28672 Feb  9 11:42 js
2026-02-09T11:42:15.7268901Z drwxr-xr-x 2 runner runner  4096 Feb  9 11:42 md
2026-02-09T11:42:15.7269597Z -rwxr-xr-x 1 runner runner 10911 Feb  8 20:56 setup.sh
2026-02-09T11:42:15.7270643Z drwxr-xr-x 2 runner runner  4096 Feb  9 11:42 sh
2026-02-09T11:42:15.7271374Z drwxr-xr-x 2 runner runner  4096 Feb  9 11:42 src
2026-02-09T11:42:15.7272387Z Files in /home/runner/work/_actions/github/gh-aw/15d0e133ebb103ed42485353efea00d7c8c07304/actions/setup/js:
2026-02-09T11:42:15.7273419Z TESTING_LIVE_API.md
2026-02-09T11:42:15.7273883Z add_comment.cjs
2026-02-09T11:42:15.7274665Z add_comment.test.cjs
2026-02-09T11:42:15.7275278Z add_copilot_reviewer.cjs
2026-02-09T11:42:15.7275796Z add_copilot_reviewer.test.cjs
2026-02-09T11:42:15.7276331Z add_labels.cjs
2026-02-09T11:42:15.7276803Z add_labels.test.cjs
2026-02-09T11:42:15.7277296Z add_reaction.cjs
2026-02-09T11:42:15.7277761Z add_reaction_and_edit_comment.cjs
2026-02-09T11:42:15.7278365Z add_reaction_and_edit_comment.test.cjs
2026-02-09T11:42:15.7279396Z Found 363 files in /home/runner/work/_actions/github/gh-aw/15d0e133ebb103ed42485353efea00d7c8c07304/actions/setup/js
2026-02-09T11:42:15.7280415Z Copied: add_comment.cjs
2026-02-09T11:42:15.7280970Z Copied: add_comment.test.cjs
2026-02-09T11:42:15.7281545Z Copied: add_copilot_reviewer.cjs
2026-02-09T11:42:15.7282129Z Copied: add_copilot_reviewer.test.cjs
2026-02-09T11:42:15.7282674Z Copied: add_labels.cjs
2026-02-09T11:42:15.7283281Z Copied: add_labels.test.cjs
2026-02-09T11:42:15.7283797Z Copied: add_reaction.cjs
2026-02-09T11:42:15.7292937Z Copied: add_reaction_and_edit_comment.cjs
2026-02-09T11:42:15.7293755Z Copied: add_reaction_and_edit_comment.test.cjs
2026-02-09T11:42:15.7294762Z Copied: add_reviewer.cjs
2026-02-09T11:42:15.7295310Z Copied: add_reviewer.test.cjs
2026-02-09T11:42:15.7295933Z Copied: add_workflow_run_comment.cjs
2026-02-09T11:42:15.7296533Z Copied: assign_agent_helpers.cjs
2026-02-09T11:42:15.7297097Z Copied: assign_agent_helpers.test.cjs
2026-02-09T11:42:15.7297820Z Copied: assign_copilot_to_created_issues.cjs
2026-02-09T11:42:15.7298769Z Copied: assign_copilot_to_created_issues.test.cjs
2026-02-09T11:42:15.7299461Z Copied: assign_issue.cjs
2026-02-09T11:42:15.7300055Z Copied: assign_issue.test.cjs
2026-02-09T11:42:15.7300600Z Copied: assign_milestone.cjs
2026-02-09T11:42:15.7301161Z Copied: assign_milestone.test.cjs
2026-02-09T11:42:15.7301732Z Copied: assign_to_agent.cjs
2026-02-09T11:42:15.7302288Z Copied: assign_to_agent.test.cjs
2026-02-09T11:42:15.7302814Z Copied: assign_to_user.cjs
2026-02-09T11:42:15.7303362Z Copied: assign_to_user.test.cjs
2026-02-09T11:42:15.7304188Z Copied: autofix_code_scanning_alert.cjs
2026-02-09T11:42:15.7304881Z Copied: autofix_code_scanning_alert.test.cjs
2026-02-09T11:42:15.7558068Z Copied: check_admin_permissions.test.cjs
2026-02-09T11:42:15.7563071Z Copied: check_command_position.cjs
2026-02-09T11:42:15.7564265Z Copied: check_command_position.test.cjs
2026-02-09T11:42:15.7565925Z Copied: check_membership.cjs
2026-02-09T11:42:15.7566554Z Copied: check_membership.test.cjs
2026-02-09T11:42:15.7567414Z Copied: check_permissions.cjs
2026-02-09T11:42:15.7568748Z Copied: check_permissions.test.cjs
2026-02-09T11:42:15.7570256Z Copied: check_permissions_utils.cjs
2026-02-09T11:42:15.7570857Z Copied: check_permissions_utils.test.cjs
2026-02-09T11:42:15.7571435Z Copied: check_skip_if_match.cjs
2026-02-09T11:42:15.7573211Z Copied: check_skip_if_match.test.cjs
2026-02-09T11:42:15.7573811Z Copied: check_skip_if_no_match.cjs
2026-02-09T11:42:15.7574587Z Copied: check_skip_if_no_match.test.cjs
2026-02-09T11:42:15.7576510Z Copied: check_stop_time.cjs
2026-02-09T11:42:15.7577053Z Copied: check_stop_time.test.cjs
2026-02-09T11:42:15.7577576Z Copied: check_team_member.cjs
2026-02-09T11:42:15.7578079Z Copied: check_team_member.test.cjs
2026-02-09T11:42:15.7580399Z Copied: check_workflow_recompile_needed.cjs
2026-02-09T11:42:15.7581103Z Copied: check_workflow_recompile_needed.test.cjs
2026-02-09T11:42:15.7583053Z Copied: check_workflow_timestamp.cjs
2026-02-09T11:42:15.7583847Z Copied: check_workflow_timestamp.test.cjs
2026-02-09T11:42:15.7584673Z Copied: check_workflow_timestamp_api.cjs
2026-02-09T11:42:15.7586656Z Copied: check_workflow_timestamp_api.test.cjs
2026-02-09T11:42:15.7590433Z Copied: checkout_pr_branch.cjs
2026-02-09T11:42:15.7590950Z Copied: checkout_pr_branch.test.cjs
2026-02-09T11:42:15.7592971Z Copied: close_discussion.cjs
2026-02-09T11:42:15.7593733Z Copied: close_entity_helpers.cjs
2026-02-09T11:42:15.7615381Z Copied: close_entity_helpers.test.cjs
2026-02-09T11:42:15.7615985Z Copied: close_expired_discussions.cjs
2026-02-09T11:42:15.7616562Z Copied: close_expired_discussions.test.cjs
2026-02-09T11:42:15.7618436Z Copied: close_expired_issues.cjs
2026-02-09T11:42:15.7619270Z Copied: close_expired_issues.test.cjs
2026-02-09T11:42:15.7619826Z Copied: close_expired_pull_requests.cjs
2026-02-09T11:42:15.7620399Z Copied: close_expired_pull_requests.test.cjs
2026-02-09T11:42:15.7622464Z Copied: close_issue.cjs
2026-02-09T11:42:15.7622961Z Copied: close_older_discussions.cjs
2026-02-09T11:42:15.7623560Z Copied: close_older_discussions.test.cjs
2026-02-09T11:42:15.7647362Z Copied: close_older_issues.cjs
2026-02-09T11:42:15.7647934Z Copied: close_older_issues.test.cjs
2026-02-09T11:42:15.7648494Z Copied: close_pull_request.cjs
2026-02-09T11:42:15.7649012Z Copied: collect_ndjson_output.cjs
2026-02-09T11:42:15.7651346Z Copied: collect_ndjson_output.test.cjs
2026-02-09T11:42:15.7651928Z Copied: compute_text.cjs
2026-02-09T11:42:15.7652439Z Copied: compute_text.test.cjs
2026-02-09T11:42:15.7652923Z Copied: constants.cjs
2026-02-09T11:42:15.7655037Z Copied: constants.test.cjs
2026-02-09T11:42:15.7655647Z Copied: create_agent_session.cjs
2026-02-09T11:42:15.7656175Z Copied: create_agent_session.test.cjs
2026-02-09T11:42:15.7656725Z Copied: create_code_scanning_alert.cjs
2026-02-09T11:42:15.7659481Z Copied: create_code_scanning_alert.test.cjs
2026-02-09T11:42:15.7660162Z Copied: create_discussion.cjs
2026-02-09T11:42:15.7660710Z Copied: create_discussion_fallback.test.cjs
2026-02-09T11:42:15.7661280Z Copied: create_issue.cjs
2026-02-09T11:42:15.7662062Z Copied: create_issue.test.cjs
2026-02-09T11:42:15.7664303Z Copied: create_issue_group.test.cjs
2026-02-09T11:42:15.7664885Z Copied: create_issue_new_arch.test.cjs
2026-02-09T11:42:15.7665474Z Copied: create_missing_data_issue.cjs
2026-02-09T11:42:15.7666008Z Copied: create_missing_tool_issue.cjs
2026-02-09T11:42:15.7666939Z Copied: create_pr_review_comment.cjs
2026-02-09T11:42:15.7671636Z Copied: create_pr_review_comment.test.cjs
2026-02-09T11:42:15.7672277Z Copied: create_project.cjs
2026-02-09T11:42:15.7672796Z Copied: create_project_status_update.cjs
2026-02-09T11:42:15.7684201Z Copied: create_project_status_update.test.cjs
2026-02-09T11:42:15.7685081Z Copied: create_pull_request.cjs
2026-02-09T11:42:15.7687116Z Copied: demo_enhanced_errors.cjs
2026-02-09T11:42:15.7687720Z Copied: determine_automatic_lockdown.cjs
2026-02-09T11:42:15.7688541Z Copied: determine_automatic_lockdown.test.cjs
2026-02-09T11:42:15.7689565Z Copied: dispatch_workflow.cjs
2026-02-09T11:42:15.7691346Z Copied: dispatch_workflow.test.cjs
2026-02-09T11:42:15.7691997Z Copied: display_file_helpers.cjs
2026-02-09T11:42:15.7692625Z Copied: display_file_helpers.test.cjs
2026-02-09T11:42:15.7693594Z Copied: ephemerals.cjs
2026-02-09T11:42:15.7702958Z Copied: ephemerals.test.cjs
2026-02-09T11:42:15.7703568Z Copied: error_helpers.cjs
2026-02-09T11:42:15.7704430Z Copied: error_helpers.test.cjs
2026-02-09T11:42:15.7706425Z Copied: error_recovery.cjs
2026-02-09T11:42:15.7706944Z Copied: error_recovery.test.cjs
2026-02-09T11:42:15.7707440Z Copied: estimate_tokens.cjs
2026-02-09T11:42:15.7707936Z Copied: estimate_tokens.test.cjs
2026-02-09T11:42:15.7708440Z Copied: expiration_helpers.cjs
2026-02-09T11:42:15.7710203Z Copied: expired_entity_cleanup_helpers.cjs
2026-02-09T11:42:15.7710992Z Copied: expired_entity_main_flow.cjs
2026-02-09T11:42:15.7716073Z Copied: expired_entity_main_flow.test.cjs
2026-02-09T11:42:15.7718119Z Copied: expired_entity_search_helpers.cjs
2026-02-09T11:42:15.7718784Z Copied: expired_entity_search_helpers.test.cjs
2026-02-09T11:42:15.7719393Z Copied: file_helpers.cjs
2026-02-09T11:42:15.7719853Z Copied: file_helpers.test.cjs
2026-02-09T11:42:15.7720373Z Copied: firewall_blocked_domains.cjs
2026-02-09T11:42:15.7722323Z Copied: firewall_blocked_domains.test.cjs
2026-02-09T11:42:15.7723001Z Copied: frontmatter_hash.cjs
2026-02-09T11:42:15.7723503Z Copied: frontmatter_hash.test.cjs
2026-02-09T11:42:15.7735361Z Copied: frontmatter_hash_github_api.test.cjs
2026-02-09T11:42:15.7737243Z Copied: frontmatter_hash_pure.cjs
2026-02-09T11:42:15.7737797Z Copied: frontmatter_hash_pure.test.cjs
2026-02-09T11:42:15.7738445Z Copied: fuzz_markdown_code_region_balancer_harness.cjs
2026-02-09T11:42:15.7739079Z Copied: fuzz_mentions_harness.cjs
2026-02-09T11:42:15.7739646Z Copied: fuzz_sanitize_incoming_text_harness.cjs
2026-02-09T11:42:15.7740255Z Copied: fuzz_sanitize_label_harness.cjs
2026-02-09T11:42:15.7740811Z Copied: fuzz_sanitize_output_harness.cjs
2026-02-09T11:42:15.7741407Z Copied: fuzz_template_substitution_harness.cjs
2026-02-09T11:42:15.7742064Z Copied: fuzz_template_substitution_harness.test.cjs
2026-02-09T11:42:15.7742677Z Copied: fuzz_update_body_harness.cjs
2026-02-09T11:42:15.7743222Z Copied: generate_compact_schema.cjs
2026-02-09T11:42:15.7743765Z Copied: generate_compact_schema.test.cjs
2026-02-09T11:42:15.7751655Z Copied: generate_footer.cjs
2026-02-09T11:42:15.7752183Z Copied: generate_footer.test.cjs
2026-02-09T11:42:15.7752708Z Copied: generate_git_patch.cjs
2026-02-09T11:42:15.7753222Z Copied: generate_git_patch.test.cjs
2026-02-09T11:42:15.7753762Z Copied: generate_safe_inputs_config.cjs
2026-02-09T11:42:15.7754845Z Copied: generate_safe_inputs_config.test.cjs
2026-02-09T11:42:15.7755453Z Copied: generate_workflow_overview.cjs
2026-02-09T11:42:15.7756024Z Copied: generate_workflow_overview.test.cjs
2026-02-09T11:42:15.7756581Z Copied: get_base_branch.cjs
2026-02-09T11:42:15.7757057Z Copied: get_base_branch.test.cjs
2026-02-09T11:42:15.7757558Z Copied: get_current_branch.cjs
2026-02-09T11:42:15.7758263Z Copied: get_current_branch.test.cjs
2026-02-09T11:42:15.7758810Z Copied: get_repository_url.cjs
2026-02-09T11:42:15.7759293Z Copied: get_repository_url.test.cjs
2026-02-09T11:42:15.7759827Z Copied: get_tracker_id.cjs
2026-02-09T11:42:15.7761309Z Copied: get_tracker_id.test.cjs
2026-02-09T11:42:15.7762456Z Copied: github_api_helpers.cjs
2026-02-09T11:42:15.7762976Z Copied: github_api_helpers.test.cjs
2026-02-09T11:42:15.7763502Z Copied: glob_pattern_helpers.cjs
2026-02-09T11:42:15.7764763Z Copied: glob_pattern_helpers.test.cjs
2026-02-09T11:42:15.7766292Z Copied: handle_agent_failure.cjs
2026-02-09T11:42:15.7766834Z Copied: handle_agent_failure.test.cjs
2026-02-09T11:42:15.7767371Z Copied: handle_create_pr_error.cjs
2026-02-09T11:42:15.7767880Z Copied: hide_comment.cjs
2026-02-09T11:42:15.7771200Z Copied: interpolate_prompt.cjs
2026-02-09T11:42:15.7772984Z Copied: interpolate_prompt.test.cjs
2026-02-09T11:42:15.7773672Z Copied: interpolate_prompt_additional.test.cjs
2026-02-09T11:42:15.7782809Z Copied: is_truthy.cjs
2026-02-09T11:42:15.7785047Z Copied: is_truthy.test.cjs
2026-02-09T11:42:15.7785554Z Copied: json_repair_helpers.cjs
2026-02-09T11:42:15.7786064Z Copied: json_repair_helpers.test.cjs
2026-02-09T11:42:15.7786586Z Copied: link_sub_issue.cjs
2026-02-09T11:42:15.7787056Z Copied: link_sub_issue.test.cjs
2026-02-09T11:42:15.7788813Z Copied: load_agent_output.cjs
2026-02-09T11:42:15.7789438Z Copied: load_agent_output.test.cjs
2026-02-09T11:42:15.7789996Z Copied: lock-issue.cjs
2026-02-09T11:42:15.7790450Z Copied: lock-issue.test.cjs
2026-02-09T11:42:15.7790929Z Copied: log_parser_bootstrap.cjs
2026-02-09T11:42:15.7792855Z Copied: log_parser_bootstrap.test.cjs
2026-02-09T11:42:15.7793467Z Copied: log_parser_shared.cjs
2026-02-09T11:42:15.7797593Z Copied: log_parser_shared.test.cjs
2026-02-09T11:42:15.7798323Z Copied: mark_pull_request_as_ready_for_review.cjs
2026-02-09T11:42:15.7800343Z Copied: markdown_code_region_balancer.cjs
2026-02-09T11:42:15.7801027Z Copied: markdown_code_region_balancer.test.cjs
2026-02-09T11:42:15.7801636Z Copied: markdown_transformer.cjs
2026-02-09T11:42:15.7802150Z Copied: markdown_transformer.test.cjs
2026-02-09T11:42:15.7802679Z Copied: markdown_unfencing.cjs
2026-02-09T11:42:16.4981542Z Copied: markdown_unfencing.test.cjs
2026-02-09T11:42:16.4982161Z Copied: mcp_enhanced_errors.cjs
2026-02-09T11:42:16.4982671Z Copied: mcp_enhanced_errors.test.cjs
2026-02-09T11:42:16.4983199Z Copied: mcp_handler_go.cjs
2026-02-09T11:42:16.4983661Z Copied: mcp_handler_go.test.cjs
2026-02-09T11:42:16.4984471Z Copied: mcp_handler_javascript.cjs
2026-02-09T11:42:16.4985021Z Copied: mcp_handler_javascript.test.cjs
2026-02-09T11:42:16.4985558Z Copied: mcp_handler_python.cjs
2026-02-09T11:42:16.4986056Z Copied: mcp_handler_shell.cjs
2026-02-09T11:42:16.4986551Z Copied: mcp_http_transport.cjs
2026-02-09T11:42:16.4987056Z Copied: mcp_http_transport.test.cjs
2026-02-09T11:42:16.4987561Z Copied: mcp_logger.cjs
2026-02-09T11:42:16.4987998Z Copied: mcp_logger.test.cjs
2026-02-09T11:42:16.4988461Z Copied: mcp_server_core.cjs
2026-02-09T11:42:16.4988970Z Copied: mcp_server_core.test.cjs
2026-02-09T11:42:16.4989497Z Copied: merge_remote_agent_github_folder.cjs
2026-02-09T11:42:16.4990061Z Copied: messages.cjs
2026-02-09T11:42:16.4990498Z Copied: messages.test.cjs
2026-02-09T11:42:16.4990971Z Copied: messages_close_discussion.cjs
2026-02-09T11:42:16.4991489Z Copied: messages_core.cjs
2026-02-09T11:42:16.4991946Z Copied: messages_footer.cjs
2026-02-09T11:42:16.4992435Z Copied: messages_run_status.cjs
2026-02-09T11:42:16.4992940Z Copied: messages_staged.cjs
2026-02-09T11:42:16.4993406Z Copied: missing_data.cjs
2026-02-09T11:42:16.4993855Z Copied: missing_data.test.cjs
2026-02-09T11:42:16.4994611Z Copied: missing_info_formatter.cjs
2026-02-09T11:42:16.4995157Z Copied: missing_info_formatter.test.cjs
2026-02-09T11:42:16.4995725Z Copied: missing_messages_helper.cjs
2026-02-09T11:42:16.4996270Z Copied: missing_messages_helper.test.cjs
2026-02-09T11:42:16.4996803Z Copied: missing_tool.cjs
2026-02-09T11:42:16.4997263Z Copied: missing_tool.test.cjs
2026-02-09T11:42:16.4997958Z Copied: noop.cjs
2026-02-09T11:42:16.4998392Z Copied: noop.test.cjs
2026-02-09T11:42:16.4998830Z Copied: noop_handler.cjs
2026-02-09T11:42:16.4999302Z Copied: noop_handler.test.cjs
2026-02-09T11:42:16.4999790Z Copied: normalize_branch_name.cjs
2026-02-09T11:42:16.5000304Z Copied: normalize_branch_name.test.cjs
2026-02-09T11:42:16.5000833Z Copied: notify_comment_error.cjs
2026-02-09T11:42:16.5001331Z Copied: notify_comment_error.test.cjs
2026-02-09T11:42:16.5001849Z Copied: parse_claude_log.cjs
2026-02-09T11:42:16.5002320Z Copied: parse_claude_log.test.cjs
2026-02-09T11:42:16.5002820Z Copied: parse_codex_log.cjs
2026-02-09T11:42:16.5003291Z Copied: parse_codex_log.test.cjs
2026-02-09T11:42:16.5003783Z Copied: parse_copilot_log.cjs
2026-02-09T11:42:16.5004491Z Copied: parse_copilot_log.test.cjs
2026-02-09T11:42:16.5004998Z Copied: parse_custom_log.cjs
2026-02-09T11:42:16.5005467Z Copied: parse_custom_log.test.cjs
2026-02-09T11:42:16.5005982Z Copied: parse_firewall_logs.cjs
2026-02-09T11:42:16.5006497Z Copied: parse_firewall_logs.test.cjs
2026-02-09T11:42:16.5007028Z Copied: parse_mcp_gateway_log.cjs
2026-02-09T11:42:16.5007550Z Copied: parse_mcp_gateway_log.test.cjs
2026-02-09T11:42:16.5008070Z Copied: parse_safe_inputs_logs.cjs
2026-02-09T11:42:16.5008588Z Copied: parse_safe_inputs_logs.test.cjs
2026-02-09T11:42:16.5009137Z Copied: parse_threat_detection_results.cjs
2026-02-09T11:42:16.5009675Z Copied: pr_helpers.cjs
2026-02-09T11:42:16.5010213Z Copied: pr_helpers.test.cjs
2026-02-09T11:42:16.5010686Z Copied: push_repo_memory.cjs
2026-02-09T11:42:16.5011157Z Copied: push_repo_memory.test.cjs
2026-02-09T11:42:16.5011671Z Copied: push_to_pull_request_branch.cjs
2026-02-09T11:42:16.5012190Z Copied: read_buffer.cjs
2026-02-09T11:42:16.5012636Z Copied: read_buffer.test.cjs
2026-02-09T11:42:16.5013117Z Copied: redact_secrets.cjs
2026-02-09T11:42:16.5013582Z Copied: redact_secrets.test.cjs
2026-02-09T11:42:16.5014285Z Copied: remove_duplicate_title.cjs
2026-02-09T11:42:16.5014827Z Copied: remove_duplicate_title.test.cjs
2026-02-09T11:42:16.5015397Z Copied: remove_labels.cjs
2026-02-09T11:42:16.5015858Z Copied: remove_labels.test.cjs
2026-02-09T11:42:16.5016527Z Copied: render_template.cjs
2026-02-09T11:42:16.5016996Z Copied: render_template.test.cjs
2026-02-09T11:42:16.5017497Z Copied: repo_helpers.cjs
2026-02-09T11:42:16.5017960Z Copied: repo_helpers.test.cjs
2026-02-09T11:42:16.5018451Z Copied: resolve_mentions.cjs
2026-02-09T11:42:16.5018940Z Copied: resolve_mentions.test.cjs
2026-02-09T11:42:16.5019463Z Copied: resolve_mentions_from_payload.cjs
2026-02-09T11:42:16.5020009Z Copied: runtime_import.cjs
2026-02-09T11:42:16.5020480Z Copied: runtime_import.test.cjs
2026-02-09T11:42:16.5020986Z Copied: safe-outputs-mcp-server.cjs
2026-02-09T11:42:16.5021535Z Copied: safe_inputs_bootstrap.cjs
2026-02-09T11:42:16.5022059Z Copied: safe_inputs_bootstrap.test.cjs
2026-02-09T11:42:16.5022597Z Copied: safe_inputs_config_loader.cjs
2026-02-09T11:42:16.5023155Z Copied: safe_inputs_config_loader.test.cjs
2026-02-09T11:42:16.5023714Z Copied: safe_inputs_mcp_server.cjs
2026-02-09T11:42:16.5024469Z Copied: safe_inputs_mcp_server.test.cjs
2026-02-09T11:42:16.5025041Z Copied: safe_inputs_mcp_server_http.cjs
2026-02-09T11:42:16.5025610Z Copied: safe_inputs_mcp_server_http.test.cjs
2026-02-09T11:42:16.5026181Z Copied: safe_inputs_tool_factory.cjs
2026-02-09T11:42:16.5026717Z Copied: safe_inputs_tool_factory.test.cjs
2026-02-09T11:42:16.5027264Z Copied: safe_inputs_validation.cjs
2026-02-09T11:42:16.5027781Z Copied: safe_inputs_validation.test.cjs
2026-02-09T11:42:16.5028340Z Copied: safe_output_handler_manager.cjs
2026-02-09T11:42:16.5028899Z Copied: safe_output_handler_manager.test.cjs
2026-02-09T11:42:16.5029457Z Copied: safe_output_helpers.cjs
2026-02-09T11:42:16.5029962Z Copied: safe_output_helpers.test.cjs
2026-02-09T11:42:16.5030485Z Copied: safe_output_processor.cjs
2026-02-09T11:42:16.5030999Z Copied: safe_output_processor.test.cjs
2026-02-09T11:42:16.5031526Z Copied: safe_output_summary.cjs
2026-02-09T11:42:16.5032163Z Copied: safe_output_summary.test.cjs
2026-02-09T11:42:16.5032715Z Copied: safe_output_topological_sort.cjs
2026-02-09T11:42:16.5033295Z Copied: safe_output_topological_sort.test.cjs
2026-02-09T11:42:16.5033878Z Copied: safe_output_type_validator.cjs
2026-02-09T11:42:16.5035450Z Copied: safe_output_type_validator.test.cjs
2026-02-09T11:42:16.5036051Z Copied: safe_output_types_validation.test.cjs
2026-02-09T11:42:16.5036669Z Copied: safe_output_unified_handler_manager.cjs
2026-02-09T11:42:16.5037311Z Copied: safe_output_unified_handler_manager.test.cjs
2026-02-09T11:42:16.5037913Z Copied: safe_output_validator.cjs
2026-02-09T11:42:16.5038428Z Copied: safe_output_validator.test.cjs
2026-02-09T11:42:16.5038959Z Copied: safe_outputs_append.cjs
2026-02-09T11:42:16.5039458Z Copied: safe_outputs_append.test.cjs
2026-02-09T11:42:16.5039980Z Copied: safe_outputs_bootstrap.cjs
2026-02-09T11:42:16.5040501Z Copied: safe_outputs_bootstrap.test.cjs
2026-02-09T11:42:16.5041085Z Copied: safe_outputs_branch_detection.test.cjs
2026-02-09T11:42:16.5041677Z Copied: safe_outputs_config.cjs
2026-02-09T11:42:16.5042190Z Copied: safe_outputs_config.test.cjs
2026-02-09T11:42:16.5042742Z Copied: safe_outputs_handlers.cjs
2026-02-09T11:42:16.5043258Z Copied: safe_outputs_handlers.test.cjs
2026-02-09T11:42:16.5043785Z Copied: safe_outputs_mcp_client.cjs
2026-02-09T11:42:16.5044530Z Copied: safe_outputs_mcp_client.test.cjs
2026-02-09T11:42:16.5045121Z Copied: safe_outputs_mcp_error_messages.test.cjs
2026-02-09T11:42:16.5045754Z Copied: safe_outputs_mcp_large_content.test.cjs
2026-02-09T11:42:16.5046385Z Copied: safe_outputs_mcp_schema_validation.test.cjs
2026-02-09T11:42:16.5046989Z Copied: safe_outputs_mcp_server.cjs
2026-02-09T11:42:16.5047517Z Copied: safe_outputs_mcp_server.test.cjs
2026-02-09T11:42:16.5048114Z Copied: safe_outputs_mcp_server_defaults.test.cjs
2026-02-09T11:42:16.5048723Z Copied: safe_outputs_mcp_server_http.cjs
2026-02-09T11:42:16.5049325Z Copied: safe_outputs_mcp_server_http_dispatch.test.cjs
2026-02-09T11:42:16.5050003Z Copied: safe_outputs_mcp_server_patch.test.cjs
2026-02-09T11:42:16.5050583Z Copied: safe_outputs_tools_loader.cjs
2026-02-09T11:42:16.5051317Z Copied: safe_outputs_tools_loader.test.cjs
2026-02-09T11:42:16.5051906Z Copied: safe_outputs_type_validation.test.cjs
2026-02-09T11:42:16.5052494Z Copied: sanitize_content.cjs
2026-02-09T11:42:16.5053000Z Copied: sanitize_content.test.cjs
2026-02-09T11:42:16.5053508Z Copied: sanitize_content_core.cjs
2026-02-09T11:42:16.5054187Z Copied: sanitize_incoming_text.cjs
2026-02-09T11:42:16.5054717Z Copied: sanitize_label_content.cjs
2026-02-09T11:42:16.5055235Z Copied: sanitize_label_content.test.cjs
2026-02-09T11:42:16.5055769Z Copied: sanitize_output.cjs
2026-02-09T11:42:16.5056245Z Copied: sanitize_output.test.cjs
2026-02-09T11:42:16.5056747Z Copied: sanitize_workflow_name.cjs
2026-02-09T11:42:16.5057263Z Copied: sanitize_workflow_name.test.cjs
2026-02-09T11:42:16.5057788Z Copied: setup_globals.cjs
2026-02-09T11:42:16.5058253Z Copied: setup_threat_detection.cjs
2026-02-09T11:42:16.5058771Z Copied: staged_preview.cjs
2026-02-09T11:42:16.5059240Z Copied: staged_preview.test.cjs
2026-02-09T11:42:16.5059721Z Copied: sub_issue_helpers.cjs
2026-02-09T11:42:16.5060222Z Copied: sub_issue_helpers.test.cjs
2026-02-09T11:42:16.5060731Z Copied: substitute_placeholders.cjs
2026-02-09T11:42:16.5061272Z Copied: substitute_placeholders.test.cjs
2026-02-09T11:42:16.5061816Z Copied: temporary_id.cjs
2026-02-09T11:42:16.5062280Z Copied: temporary_id.test.cjs
2026-02-09T11:42:16.5062779Z Copied: test-live-github-api.cjs
2026-02-09T11:42:16.5063292Z Copied: unlock-issue.cjs
2026-02-09T11:42:16.5063752Z Copied: unlock-issue.test.cjs
2026-02-09T11:42:16.5064450Z Copied: update_activation_comment.cjs
2026-02-09T11:42:16.5065023Z Copied: update_activation_comment.test.cjs
2026-02-09T11:42:16.5065591Z Copied: update_context_helpers.cjs
2026-02-09T11:42:16.5066123Z Copied: update_context_helpers.test.cjs
2026-02-09T11:42:16.5066658Z Copied: update_discussion.cjs
2026-02-09T11:42:16.5067329Z Copied: update_handler_factory.cjs
2026-02-09T11:42:16.5067878Z Copied: update_handler_factory.test.cjs
2026-02-09T11:42:16.5068404Z Copied: update_issue.cjs
2026-02-09T11:42:16.5068871Z Copied: update_issue.test.cjs
2026-02-09T11:42:16.5069377Z Copied: update_issue_generator.test.cjs
2026-02-09T11:42:16.5070231Z Copied: update_pr_description_helpers.cjs
2026-02-09T11:42:16.5070857Z Copied: update_pr_description_helpers.test.cjs
2026-02-09T11:42:16.5071442Z Copied: update_project.cjs
2026-02-09T11:42:16.5071913Z Copied: update_project.test.cjs
2026-02-09T11:42:16.5072422Z Copied: update_pull_request.cjs
2026-02-09T11:42:16.5072918Z Copied: update_pull_request.test.cjs
2026-02-09T11:42:16.5073430Z Copied: update_release.cjs
2026-02-09T11:42:16.5073896Z Copied: update_release.test.cjs
2026-02-09T11:42:16.5074572Z Copied: update_runner.cjs
2026-02-09T11:42:16.5075034Z Copied: update_runner.test.cjs
2026-02-09T11:42:16.5075521Z Copied: upload_assets.cjs
2026-02-09T11:42:16.5075981Z Copied: upload_assets.test.cjs
2026-02-09T11:42:16.5076483Z Copied: validate_secrets.cjs
2026-02-09T11:42:16.5076974Z Copied: validate_secrets.test.cjs
2026-02-09T11:42:16.5077495Z Copied: write_large_content_to_file.cjs
2026-02-09T11:42:16.5078061Z Copied: write_large_content_to_file.test.cjs
2026-02-09T11:42:16.5078621Z Copied: package-lock.json
2026-02-09T11:42:16.5079090Z Copied: package.json
2026-02-09T11:42:16.5079523Z Copied: safe_outputs_tools.json
2026-02-09T11:42:16.5080013Z Copied: tsconfig.build.json
2026-02-09T11:42:16.5080470Z Copied: tsconfig.json
2026-02-09T11:42:16.5081446Z Found shell scripts directory: /home/runner/work/_actions/github/gh-aw/15d0e133ebb103ed42485353efea00d7c8c07304/actions/setup/sh
2026-02-09T11:42:16.5082540Z Copied shell script: check_mcp_servers.sh
2026-02-09T11:42:16.5083136Z Copied shell script: check_mcp_servers_test.sh
2026-02-09T11:42:16.5083763Z Copied shell script: clone_repo_memory_branch.sh
2026-02-09T11:42:16.5084588Z Copied shell script: convert_gateway_config_claude.sh
2026-02-09T11:42:16.5085286Z Copied shell script: convert_gateway_config_codex.sh
2026-02-09T11:42:16.5085977Z Copied shell script: convert_gateway_config_codex_test.sh
2026-02-09T11:42:16.5086850Z Copied shell script: convert_gateway_config_copilot.sh
2026-02-09T11:42:16.5087510Z Copied shell script: create_cache_memory_dir.sh
2026-02-09T11:42:16.5088127Z Copied shell script: create_gh_aw_tmp_dir.sh
2026-02-09T11:42:16.5088719Z Copied shell script: create_prompt_first.sh
2026-02-09T11:42:16.5089308Z Copied shell script: download_docker_images.sh
2026-02-09T11:42:16.5089937Z Copied shell script: download_docker_images_test.sh
2026-02-09T11:42:16.5090556Z Copied shell script: generate_git_patch.sh
2026-02-09T11:42:16.5091129Z Copied shell script: install_awf_binary.sh
2026-02-09T11:42:16.5091702Z Copied shell script: install_copilot_cli.sh
2026-02-09T11:42:16.5092291Z Copied shell script: print_prompt_summary.sh
2026-02-09T11:42:16.5092859Z Copied shell script: sanitize_path.sh
2026-02-09T11:42:16.5093423Z Copied shell script: sanitize_path_test.sh
2026-02-09T11:42:16.5094162Z Copied shell script: start_mcp_gateway.sh
2026-02-09T11:42:16.5094751Z Copied shell script: start_mcp_gateway_test.sh
2026-02-09T11:42:16.5095382Z Copied shell script: start_safe_inputs_server.sh
2026-02-09T11:42:16.5096013Z Copied shell script: start_safe_outputs_server.sh
2026-02-09T11:42:16.5096621Z Copied shell script: start_serena_server.sh
2026-02-09T11:42:16.5097376Z Copied shell script: stop_mcp_gateway.sh
2026-02-09T11:42:16.5098001Z Copied shell script: validate_gatewayed_server.sh
2026-02-09T11:42:16.5098667Z Copied shell script: validate_gatewayed_server_test.sh
2026-02-09T11:42:16.5099343Z Copied shell script: validate_multi_secret.sh
2026-02-09T11:42:16.5099993Z Copied shell script: validate_prompt_placeholders.sh
2026-02-09T11:42:16.5100690Z Copied shell script: validate_prompt_placeholders_test.sh
2026-02-09T11:42:16.5101381Z Copied shell script: verify_mcp_gateway_health.sh
2026-02-09T11:42:16.5102024Z Successfully copied 390 files to /opt/gh-aw/actions
2026-02-09T11:42:16.5102852Z Copying prompt markdown files to /opt/gh-aw/prompts
2026-02-09T11:42:16.5104211Z Found markdown prompts directory: /home/runner/work/_actions/github/gh-aw/15d0e133ebb103ed42485353efea00d7c8c07304/actions/setup/md
2026-02-09T11:42:16.5105367Z Copied prompt: agent_failure_comment.md
2026-02-09T11:42:16.5106021Z Copied prompt: agent_failure_issue.md
2026-02-09T11:42:16.5106570Z Copied prompt: cache_memory_prompt.md
2026-02-09T11:42:16.5107132Z Copied prompt: cache_memory_prompt_multi.md
2026-02-09T11:42:16.5107708Z Copied prompt: issue_group_parent.md
2026-02-09T11:42:16.5108243Z Copied prompt: markdown.md
2026-02-09T11:42:16.5108730Z Copied prompt: missing_data_issue.md
2026-02-09T11:42:16.5109261Z Copied prompt: missing_tool_issue.md
2026-02-09T11:42:16.5109786Z Copied prompt: playwright_prompt.md
2026-02-09T11:42:16.5110352Z Copied prompt: pr_checkout_failure.md
2026-02-09T11:42:16.5110886Z Copied prompt: pr_context_prompt.md
2026-02-09T11:42:16.5111426Z Copied prompt: temp_folder_prompt.md
2026-02-09T11:42:16.5111967Z Copied prompt: threat_detection.md
2026-02-09T11:42:16.5112492Z Copied prompt: workflow_install_note.md
2026-02-09T11:42:16.5113073Z Copied prompt: workflow_recompile_issue.md
2026-02-09T11:42:16.5113731Z Successfully copied 15 prompt files to /opt/gh-aw/prompts
2026-02-09T11:42:16.5114644Z Copying safe-inputs files to /opt/gh-aw/safe-inputs
2026-02-09T11:42:16.5115329Z Copied safe-inputs: safe_inputs_bootstrap.cjs
2026-02-09T11:42:16.5115966Z Copied safe-inputs: safe_inputs_config_loader.cjs
2026-02-09T11:42:16.5116598Z Copied safe-inputs: safe_inputs_mcp_server.cjs
2026-02-09T11:42:16.5117237Z Copied safe-inputs: safe_inputs_mcp_server_http.cjs
2026-02-09T11:42:16.5117887Z Copied safe-inputs: safe_inputs_tool_factory.cjs
2026-02-09T11:42:16.5118506Z Copied safe-inputs: safe_inputs_validation.cjs
2026-02-09T11:42:16.5119094Z Copied safe-inputs: mcp_server_core.cjs
2026-02-09T11:42:16.5119632Z Copied safe-inputs: mcp_logger.cjs
2026-02-09T11:42:16.5120181Z Copied safe-inputs: mcp_http_transport.cjs
2026-02-09T11:42:16.5121913Z Copied safe-inputs: mcp_handler_shell.cjs
2026-02-09T11:42:16.5122532Z Copied safe-inputs: mcp_handler_python.cjs
2026-02-09T11:42:16.5123327Z Copied safe-inputs: mcp_handler_go.cjs
2026-02-09T11:42:16.5123908Z Copied safe-inputs: mcp_handler_javascript.cjs
2026-02-09T11:42:16.5124736Z Copied safe-inputs: read_buffer.cjs
2026-02-09T11:42:16.5125334Z Copied safe-inputs: generate_safe_inputs_config.cjs
2026-02-09T11:42:16.5125950Z Copied safe-inputs: setup_globals.cjs
2026-02-09T11:42:16.5126865Z Copied safe-inputs: error_helpers.cjs
2026-02-09T11:42:16.5127457Z Copied safe-inputs: mcp_enhanced_errors.cjs
2026-02-09T11:42:16.5128169Z Successfully copied 18 safe-inputs files to /opt/gh-aw/safe-inputs
2026-02-09T11:42:16.5128943Z Copying safe-outputs files to /opt/gh-aw/safeoutputs
2026-02-09T11:42:16.5129591Z Copied safe-outputs: safe_outputs_mcp_server.cjs
2026-02-09T11:42:16.5130246Z Copied safe-outputs: safe_outputs_mcp_server_http.cjs
2026-02-09T11:42:16.5130912Z Copied safe-outputs: safe_outputs_bootstrap.cjs
2026-02-09T11:42:16.5131564Z Copied safe-outputs: safe_outputs_tools_loader.cjs
2026-02-09T11:42:16.5132200Z Copied safe-outputs: safe_outputs_config.cjs
2026-02-09T11:42:16.5132796Z Copied safe-outputs: safe_outputs_handlers.cjs
2026-02-09T11:42:16.5133397Z Copied safe-outputs: safe_outputs_append.cjs
2026-02-09T11:42:16.5134144Z Copied safe-outputs: mcp_server_core.cjs
2026-02-09T11:42:16.5134702Z Copied safe-outputs: mcp_logger.cjs
2026-02-09T11:42:16.5135243Z Copied safe-outputs: mcp_http_transport.cjs
2026-02-09T11:42:16.5135825Z Copied safe-outputs: mcp_handler_python.cjs
2026-02-09T11:42:16.5136403Z Copied safe-outputs: mcp_handler_shell.cjs
2026-02-09T11:42:16.5136961Z Copied safe-outputs: mcp_handler_go.cjs
2026-02-09T11:42:16.5143652Z Copied safe-outputs: mcp_handler_javascript.cjs
2026-02-09T11:42:16.5144808Z Copied safe-outputs: read_buffer.cjs
2026-02-09T11:42:16.5145410Z Copied safe-outputs: safe_inputs_validation.cjs
2026-02-09T11:42:16.5146225Z Copied safe-outputs: messages.cjs
2026-02-09T11:42:16.5146770Z Copied safe-outputs: messages_core.cjs
2026-02-09T11:42:16.5147319Z Copied safe-outputs: messages_footer.cjs
2026-02-09T11:42:16.5147888Z Copied safe-outputs: messages_run_status.cjs
2026-02-09T11:42:16.5148445Z Copied safe-outputs: messages_staged.cjs
2026-02-09T11:42:16.5149032Z Copied safe-outputs: messages_close_discussion.cjs
2026-02-09T11:42:16.5149637Z Copied safe-outputs: estimate_tokens.cjs
2026-02-09T11:42:16.5150192Z Copied safe-outputs: generate_git_patch.cjs
2026-02-09T11:42:16.5150769Z Copied safe-outputs: get_base_branch.cjs
2026-02-09T11:42:16.5151330Z Copied safe-outputs: get_current_branch.cjs
2026-02-09T11:42:16.5151925Z Copied safe-outputs: normalize_branch_name.cjs
2026-02-09T11:42:16.5152554Z Copied safe-outputs: write_large_content_to_file.cjs
2026-02-09T11:42:16.5153207Z Copied safe-outputs: generate_compact_schema.cjs
2026-02-09T11:42:16.5153788Z Copied safe-outputs: setup_globals.cjs
2026-02-09T11:42:16.5154561Z Copied safe-outputs: error_helpers.cjs
2026-02-09T11:42:16.5155132Z Copied safe-outputs: mcp_enhanced_errors.cjs
2026-02-09T11:42:16.5155765Z Copied safe-outputs MCP entry point: mcp-server.cjs
2026-02-09T11:42:16.5156439Z Copied safe-outputs tools definition: tools.json
2026-02-09T11:42:16.5157083Z Created empty config.json for safe-outputs server
2026-02-09T11:42:16.5157831Z Successfully copied 34 safe-outputs files to /opt/gh-aw/safeoutputs
2026-02-09T11:42:16.5158721Z Safe-output-projects not enabled - skipping @actions/github installation
2026-02-09T11:42:16.5306032Z ##[group]Run echo "Comment ID: $COMMENT_ID"
2026-02-09T11:42:16.5306807Z [36;1mecho "Comment ID: $COMMENT_ID"[0m
2026-02-09T11:42:16.5307382Z [36;1mecho "Comment Repo: $COMMENT_REPO"[0m
2026-02-09T11:42:16.5308028Z [36;1mecho "Agent Output Types: $AGENT_OUTPUT_TYPES"[0m
2026-02-09T11:42:16.5309249Z [36;1mecho "Agent Conclusion: $AGENT_CONCLUSION"[0m
2026-02-09T11:42:16.5316762Z shell: /usr/bin/bash -e {0}
2026-02-09T11:42:16.5317259Z env:
2026-02-09T11:42:16.5317626Z   COMMENT_ID: 
2026-02-09T11:42:16.5318017Z   COMMENT_REPO: 
2026-02-09T11:42:16.5318423Z   AGENT_OUTPUT_TYPES: 
2026-02-09T11:42:16.5319036Z   AGENT_CONCLUSION: failure
2026-02-09T11:42:16.5320054Z ##[endgroup]
2026-02-09T11:42:16.5365415Z Comment ID: 
2026-02-09T11:42:16.5366285Z Comment Repo: 
2026-02-09T11:42:16.5366809Z Agent Output Types: 
2026-02-09T11:42:16.5368164Z Agent Conclusion: failure
2026-02-09T11:42:16.5645977Z ##[group]Run actions/download-artifact@018cc2cf5baa6db3ef3c5f8a56943fffe632ef53
2026-02-09T11:42:16.5646945Z with:
2026-02-09T11:42:16.5647329Z   name: agent-output
2026-02-09T11:42:16.5647778Z   path: /tmp/gh-aw/safeoutputs/
2026-02-09T11:42:16.5648285Z   merge-multiple: false
2026-02-09T11:42:16.5648785Z   repository: zhengqunkoo/Luxuryshoppingwebsite
2026-02-09T11:42:16.5651104Z   run-id: 21823619609
2026-02-09T11:42:16.5651621Z ##[endgroup]
2026-02-09T11:42:17.1015229Z Downloading single artifact
2026-02-09T11:42:17.2996561Z ##[error]Unable to download artifact(s): Artifact not found for name: agent-output
        Please ensure that your artifact is not expired and the artifact was uploaded using a compatible version of toolkit/upload-artifact.
        For more information, visit the GitHub Artifacts FAQ: https://github.com/actions/toolkit/blob/main/packages/artifact/docs/faq.md
2026-02-09T11:42:17.3279820Z ##[group]Run mkdir -p /tmp/gh-aw/safeoutputs/
2026-02-09T11:42:17.3281935Z [36;1mmkdir -p /tmp/gh-aw/safeoutputs/[0m
2026-02-09T11:42:17.3282608Z [36;1mfind "/tmp/gh-aw/safeoutputs/" -type f -print[0m
2026-02-09T11:42:17.3285014Z [36;1mecho "GH_AW_AGENT_OUTPUT=/tmp/gh-aw/safeoutputs/agent_output.json" >> "$GITHUB_ENV"[0m
2026-02-09T11:42:17.3294538Z shell: /usr/bin/bash -e {0}
2026-02-09T11:42:17.3295056Z ##[endgroup]
2026-02-09T11:42:17.3679234Z ##[group]Run actions/github-script@ed597411d8f924073f98dfc5c65a23a2325f34cd
2026-02-09T11:42:17.3680989Z with:
2026-02-09T11:42:17.3682371Z   github-token: ***
2026-02-09T11:42:17.3683702Z   script: const { setupGlobals } = require('/opt/gh-aw/actions/setup_globals.cjs');
setupGlobals(core, github, context, exec, io);
const { main } = require('/opt/gh-aw/actions/noop.cjs');
await main();

2026-02-09T11:42:17.3686808Z   debug: false
2026-02-09T11:42:17.3687229Z   user-agent: actions/github-script
2026-02-09T11:42:17.3687845Z   result-encoding: json
2026-02-09T11:42:17.3688268Z   retries: 0
2026-02-09T11:42:17.3691606Z   retry-exempt-status-codes: 400,401,403,404,422
2026-02-09T11:42:17.3692198Z env:
2026-02-09T11:42:17.3692701Z   GH_AW_AGENT_OUTPUT: /tmp/gh-aw/safeoutputs/agent_output.json
2026-02-09T11:42:17.3695775Z   GH_AW_NOOP_MAX: 1
2026-02-09T11:42:17.3696271Z   GH_AW_WORKFLOW_NAME: Daily Repo Status
2026-02-09T11:42:17.3697322Z   GH_AW_WORKFLOW_SOURCE: githubnext/agentics/workflows/daily-repo-status.md@e43596e069e74a65cd7d93315091672d278c2642
2026-02-09T11:42:17.3699970Z   GH_AW_WORKFLOW_SOURCE_URL: https://github.com/githubnext/agentics/tree/e43596e069e74a65cd7d93315091672d278c2642/workflows/daily-repo-status.md
2026-02-09T11:42:17.3701494Z ##[endgroup]
2026-02-09T11:42:17.7456849Z Error reading agent output file: ENOENT: no such file or directory, open '/tmp/gh-aw/safeoutputs/agent_output.json'
2026-02-09T11:42:17.7729525Z ##[group]Run actions/github-script@ed597411d8f924073f98dfc5c65a23a2325f34cd
2026-02-09T11:42:17.7731068Z with:
2026-02-09T11:42:17.7731776Z   github-token: ***
2026-02-09T11:42:17.7733557Z   script: const { setupGlobals } = require('/opt/gh-aw/actions/setup_globals.cjs');
setupGlobals(core, github, context, exec, io);
const { main } = require('/opt/gh-aw/actions/missing_tool.cjs');
await main();

2026-02-09T11:42:17.7735516Z   debug: false
2026-02-09T11:42:17.7735942Z   user-agent: actions/github-script
2026-02-09T11:42:17.7736458Z   result-encoding: json
2026-02-09T11:42:17.7736873Z   retries: 0
2026-02-09T11:42:17.7737314Z   retry-exempt-status-codes: 400,401,403,404,422
2026-02-09T11:42:17.7737859Z env:
2026-02-09T11:42:17.7738357Z   GH_AW_AGENT_OUTPUT: /tmp/gh-aw/safeoutputs/agent_output.json
2026-02-09T11:42:17.7739034Z   GH_AW_WORKFLOW_NAME: Daily Repo Status
2026-02-09T11:42:17.7740075Z   GH_AW_WORKFLOW_SOURCE: githubnext/agentics/workflows/daily-repo-status.md@e43596e069e74a65cd7d93315091672d278c2642
2026-02-09T11:42:17.7742302Z   GH_AW_WORKFLOW_SOURCE_URL: https://github.com/githubnext/agentics/tree/e43596e069e74a65cd7d93315091672d278c2642/workflows/daily-repo-status.md
2026-02-09T11:42:17.7743462Z ##[endgroup]
2026-02-09T11:42:17.8771494Z Max count: unlimited
2026-02-09T11:42:17.8982776Z ##[group]Run actions/github-script@ed597411d8f924073f98dfc5c65a23a2325f34cd
2026-02-09T11:42:17.8983595Z with:
2026-02-09T11:42:17.8984639Z   github-token: ***
2026-02-09T11:42:17.8986084Z   script: const { setupGlobals } = require('/opt/gh-aw/actions/setup_globals.cjs');
setupGlobals(core, github, context, exec, io);
const { main } = require('/opt/gh-aw/actions/handle_agent_failure.cjs');
await main();

2026-02-09T11:42:17.8987543Z   debug: false
2026-02-09T11:42:17.8987956Z   user-agent: actions/github-script
2026-02-09T11:42:17.8988471Z   result-encoding: json
2026-02-09T11:42:17.8988885Z   retries: 0
2026-02-09T11:42:17.8989360Z   retry-exempt-status-codes: 400,401,403,404,422
2026-02-09T11:42:17.8989886Z env:
2026-02-09T11:42:17.8990376Z   GH_AW_AGENT_OUTPUT: /tmp/gh-aw/safeoutputs/agent_output.json
2026-02-09T11:42:17.8991025Z   GH_AW_WORKFLOW_NAME: Daily Repo Status
2026-02-09T11:42:17.8992042Z   GH_AW_WORKFLOW_SOURCE: githubnext/agentics/workflows/daily-repo-status.md@e43596e069e74a65cd7d93315091672d278c2642
2026-02-09T11:42:17.8994221Z   GH_AW_WORKFLOW_SOURCE_URL: https://github.com/githubnext/agentics/tree/e43596e069e74a65cd7d93315091672d278c2642/workflows/daily-repo-status.md
2026-02-09T11:42:17.8995705Z   GH_AW_RUN_URL: https://github.com/zhengqunkoo/Luxuryshoppingwebsite/actions/runs/21823619609
2026-02-09T11:42:17.8996553Z   GH_AW_AGENT_CONCLUSION: failure
2026-02-09T11:42:17.8997834Z   GH_AW_SECRET_VERIFICATION_RESULT: success
2026-02-09T11:42:17.8998429Z   GH_AW_CHECKOUT_PR_SUCCESS: true
2026-02-09T11:42:17.8998906Z ##[endgroup]
2026-02-09T11:42:18.0128182Z Agent conclusion: failure
2026-02-09T11:42:18.0133577Z Workflow name: Daily Repo Status
2026-02-09T11:42:18.0137146Z Secret verification result: success
2026-02-09T11:42:18.0140002Z Assignment error count: 0
2026-02-09T11:42:18.0142795Z Create discussion error count: 0
2026-02-09T11:42:18.0146095Z Checkout PR success: true
2026-02-09T11:42:18.0457026Z fatal: not a git repository (or any of the parent directories): .git
2026-02-09T11:42:18.0458137Z Searching for pull request from branch: main
2026-02-09T11:42:19.2241295Z No pull request found for branch: main
2026-02-09T11:42:19.2242334Z Searching for parent issue: "[agentic-workflows] Failed runs"
2026-02-09T11:42:19.2243395Z No suitable parent issue found, creating first parent
2026-02-09T11:42:19.2248988Z ✓ Created parent issue #11: https://github.com/zhengqunkoo/Luxuryshoppingwebsite/issues/11
2026-02-09T11:42:19.2250820Z Checking for existing issue with title: "[agentics] Daily Repo Status failed"
2026-02-09T11:42:19.4292054Z No existing issue found, creating a new one
2026-02-09T11:42:19.4316057Z fatal: not a git repository (or any of the parent directories): .git
2026-02-09T11:42:19.4334977Z Error reading agent output file: ENOENT: no such file or directory, open '/tmp/gh-aw/safeoutputs/agent_output.json'
2026-02-09T11:42:19.8299280Z ✓ Created new issue #12: https://github.com/zhengqunkoo/Luxuryshoppingwebsite/issues/12
2026-02-09T11:42:19.8310898Z Linking issue #12 as sub-issue of #11
2026-02-09T11:42:20.3356111Z ✓ Successfully linked #12 as sub-issue of #11
2026-02-09T11:42:20.3609971Z ##[group]Run actions/github-script@ed597411d8f924073f98dfc5c65a23a2325f34cd
2026-02-09T11:42:20.3611634Z with:
2026-02-09T11:42:20.3613041Z   github-token: ***
2026-02-09T11:42:20.3616578Z   script: const { setupGlobals } = require('/opt/gh-aw/actions/setup_globals.cjs');
setupGlobals(core, github, context, exec, io);
const { main } = require('/opt/gh-aw/actions/notify_comment_error.cjs');
await main();

2026-02-09T11:42:20.3620077Z   debug: false
2026-02-09T11:42:20.3620967Z   user-agent: actions/github-script
2026-02-09T11:42:20.3622373Z   result-encoding: json
2026-02-09T11:42:20.3623304Z   retries: 0
2026-02-09T11:42:20.3624501Z   retry-exempt-status-codes: 400,401,403,404,422
2026-02-09T11:42:20.3625741Z env:
2026-02-09T11:42:20.3626805Z   GH_AW_AGENT_OUTPUT: /tmp/gh-aw/safeoutputs/agent_output.json
2026-02-09T11:42:20.3628235Z   GH_AW_COMMENT_ID: 
2026-02-09T11:42:20.3629145Z   GH_AW_COMMENT_REPO: 
2026-02-09T11:42:20.3630888Z   GH_AW_RUN_URL: https://github.com/zhengqunkoo/Luxuryshoppingwebsite/actions/runs/21823619609
2026-02-09T11:42:20.3632889Z   GH_AW_WORKFLOW_NAME: Daily Repo Status
2026-02-09T11:42:20.3634286Z   GH_AW_AGENT_CONCLUSION: failure
2026-02-09T11:42:20.3635418Z   GH_AW_DETECTION_CONCLUSION: skipped
2026-02-09T11:42:20.3636522Z ##[endgroup]
2026-02-09T11:42:20.4928889Z Comment ID: 
2026-02-09T11:42:20.4941588Z Comment Repo: 
2026-02-09T11:42:20.4946609Z Run URL: https://github.com/zhengqunkoo/Luxuryshoppingwebsite/actions/runs/21823619609
2026-02-09T11:42:20.4984448Z Workflow Name: Daily Repo Status
2026-02-09T11:42:20.4992129Z Agent Conclusion: failure
2026-02-09T11:42:20.5037971Z Detection Conclusion: skipped
2026-02-09T11:42:20.5041940Z Error reading agent output file: ENOENT: no such file or directory, open '/tmp/gh-aw/safeoutputs/agent_output.json'
2026-02-09T11:42:20.5076523Z No comment ID found and no noop messages to process, skipping comment update
2026-02-09T11:42:20.5245271Z Evaluate and set job outputs
2026-02-09T11:42:20.5261245Z Cleaning up orphan processes
